[
  {
    "slug": "mutual-nda-bistrozzi-county",
    "title": "Mutual NDA — Bistrozzi LLC ↔ Allen County",
    "caption": "Resolution #417-25 (May 27, 2025); executed for Bistrozzi by Scott J. Ziance (Vorys), July 1, 2025.",
    "source": "legal/prr-mandamus/prr-production-2026-06-05/NDA.pdf",
    "pages": null,
    "available": true
  },
  {
    "slug": "cra-abatement-agreement",
    "title": "Community Reinvestment Area (CRA) agreement",
    "caption": "75% abatement instrument produced in the 2026-06-05 PRR batch.",
    "source": "legal/prr-mandamus/prr-production-2026-06-05/CRA.pdf",
    "pages": null,
    "available": true
  },
  {
    "slug": "prr-response-letter-1",
    "title": "PRR response letter #1 (cover)",
    "caption": "Brittany N. Woods, Clerk of the Board — June 5, 2026; the first rolling response.",
    "source": "legal/prr-mandamus/prr-production-2026-06-05/Letter-Record Request Response 1.pdf",
    "pages": null,
    "available": true
  },
  {
    "slug": "bistrozzi-air-permit-data-center",
    "title": "Ohio EPA air permit — \"Bistrozzi LLC Data Center\"",
    "caption": "Draft Permit-to-Install P0138965 naming the data-center facility (first 3 pp.).",
    "source": "permits/bistrozzi-permits/3987141.pdf",
    "pages": "0-2",
    "available": true
  }
]
