[
  {
    "slug": "mutual-nda-bistrozzi-county",
    "title": "Mutual NDA — Bistrozzi LLC ↔ Allen County",
    "caption": "Resolution #417-25 (May 27, 2025); executed for Bistrozzi by Scott J. Ziance (Vorys), July 1, 2025.",
    "source": "legal/prr-mandamus/prr-production-2026-06-05/NDA.pdf",
    "pages": null,
    "available": false
  },
  {
    "slug": "cra-abatement-agreement",
    "title": "Community Reinvestment Area (CRA) agreement",
    "caption": "75% abatement instrument produced in the 2026-06-05 PRR batch.",
    "source": "legal/prr-mandamus/prr-production-2026-06-05/CRA.pdf",
    "pages": null,
    "available": false
  },
  {
    "slug": "prr-response-letter-1",
    "title": "PRR response letter #1 (cover)",
    "caption": "Brittany N. Woods, Clerk of the Board — June 5, 2026; the first rolling response.",
    "source": "legal/prr-mandamus/prr-production-2026-06-05/Letter-Record Request Response 1.pdf",
    "pages": null,
    "available": false
  },
  {
    "slug": "bistrozzi-air-permit-data-center",
    "title": "Ohio EPA air permit — \"Bistrozzi LLC Data Center\"",
    "caption": "Final Permit-to-Install P0138965 (issued 2026-05-28) naming the data-center facility — first pages of the 66-pp permit, which also carries a 64-item Response to Comments.",
    "source": "permits/bistrozzi-permits/4132514.pdf",
    "pages": "0-2",
    "available": false
  },
  {
    "slug": "sos-bistrozzi-addition-llc",
    "title": "Secretary of State filing — Bistrozzi Addition LLC",
    "caption": "Delaware foreign-LLC registration; organizer Scott J. Ziance, agent C T Corporation.",
    "source": "permits/bistrozzi-permits/sos-bistrozzi-addition-llc-2026-04-08.pdf",
    "pages": null,
    "available": false
  },
  {
    "slug": "opc-roadwork-estimates-tetratech",
    "title": "OPC roadwork estimates (Tetra Tech)",
    "caption": "The six roundabout Opinions of Probable Cost (summary + detail sheets) sliced from the PRR-01 bundle.",
    "source": "aedg/PRR-01-bundle.ocr.pdf",
    "pages": "317-327",
    "available": false
  },
  {
    "slug": "bosc-testimony-deck",
    "title": "BOSC testimony deck (2026-06-01)",
    "caption": "Slides accompanying the written testimony to the select committee.",
    "source": "legal/select-committee-2026/relator-testimony/bosc-testimony-deck-2026-06-01.pdf",
    "pages": null,
    "available": false
  }
]
